{"algorithm_time_cold_ms":671.359627,"algorithm_time_warm_ms":661.707585,"attempted_updates":183064050,"binary":"/Users/kose/master/GPU-Accelerated-SGD-for-Stress-Minimization/implementations/full/rr_gpu/target/release/rr-gpu","cli_total_time_cold_ms":671.6617940000001,"common_preprocess_time_ms":239.7235,"completed_updates":183064050,"constraints":12204270,"cpu_model":"Apple M4 Pro","dataset":"USpowerGrid","dispatches":120,"edges":6594,"epsilon":0.1,"error_message":null,"error_stage":null,"exit_code":null,"family":"full","final_positions_path":"/Users/kose/master/GPU-Accelerated-SGD-for-Stress-Minimization/experiment_results/v2/raw/v2-rr-memory-tiling/artifacts/v2-rr-memory-tiling-USpowerGrid-rr_sgd-e38c31ea978e/attempt-1/rr-sgd-USpowerGrid-v2-rr-memory-tiling-USpowerGrid-rr_sgd-e38c31ea978e.final.txt","git_commit":"3593d62dec471a08e91dabe42a0c84f942418866","git_dirty":true,"gpu_backend":"Metal","gpu_device_time_ms":339.778666,"gpu_name":"Apple M4 Pro","initial_positions_sha256":"8eb3b13048c8299874736b36d011bd08b98e3389c763e3840461c4e07a6a41ba","input_path":"/Users/kose/master/GPU-Accelerated-SGD-for-Stress-Minimization/data/v1_lcc/USpowerGrid.mtx","input_sha256":"aac4faffbc2edd14ed031aeea76d64946d846e6b16d61d94e5d5d6a0a7aea9c0","input_time_ms":0.302167,"iteration_time_ms":361.77916700000003,"iterations":15,"method":"rr_sgd","method_setup_time_ms":0.009292,"nodes":4941,"pivots":null,"postprocess_time_ms":0.005625000000000001,"preprocess_sha256":null,"readback_time_ms":1.537959,"retry_failures":null,"rounds":8,"rr_inner_shuffle":true,"rr_memory_mode":"shared","rr_outer_shuffle":true,"rr_shared_bytes":16384,"rr_tile_size":1024,"rr_workgroup_size":256,"run_id":"v2-rr-memory-tiling-USpowerGrid-rr_sgd-e38c31ea978e","run_mode":"benchmark","runtime_init_time_ms":9.652042,"schema_version":1,"seed":5,"status":"success","stderr_log_path":null,"stress_eval_time_ms":146.52425,"stress_kind":"exact","stress_samples":null,"stress_seed":null,"stress_value":713991.857501109,"upload_time_ms":58.652042,"vertex_map_path":null}
