{"schema_version":1,"run_id":"v2-quality-timing-dwt_419-atomic_sparse_sgd-c0f68bf19192","run_mode":"benchmark","method":"atomic_sparse_sgd","binary":"/Users/kose/master/GPU-Accelerated-SGD-for-Stress-Minimization/implementations/sparse/vram-lock-sparse/target/release/vram-lock-sparse","dataset":"dwt_419","input_path":"/Users/kose/master/GPU-Accelerated-SGD-for-Stress-Minimization/data/v1_lcc/dwt_419.mtx","input_sha256":"12c72b640bc1947a3b6f35b995ab565f2eb7915e74837c981cf459bdf8daec1e","seed":12,"initial_positions_sha256":"0c179a3e07ea0de340fc319ceb066e30d56f827a3219e9ed72119ad3ddb2abcb","preprocess_sha256":"9c8765655f69d656f87f0de025397bb8f8ccd442ade345a6d2e54c1458e9ed11","status":"success","family":"sparse","git_commit":"3593d62dec471a08e91dabe42a0c84f942418866","git_dirty":true,"nodes":419,"edges":1572,"constraints":64115,"pivots":200,"iterations":15,"epsilon":0.1,"cpu_model":"Apple M4 Pro","gpu_name":"Apple M4 Pro","gpu_backend":"Metal","input_time_ms":0.519084,"common_preprocess_time_ms":12.039125,"method_setup_time_ms":0.402042,"runtime_init_time_ms":40.523625,"upload_time_ms":0.233042,"iteration_time_ms":32.717709,"gpu_device_time_ms":null,"readback_time_ms":0.0014160000000000002,"postprocess_time_ms":0.0007080000000000001,"algorithm_time_cold_ms":85.91766700000001,"algorithm_time_warm_ms":45.394042000000006,"cli_total_time_cold_ms":86.43675100000002,"stress_kind":"exact","stress_value":1406.148488447357,"stress_eval_time_ms":2.536375,"stress_samples":null,"stress_seed":null,"attempted_updates":961725,"completed_updates":961725,"retry_failures":0,"rounds":null,"dispatches":75,"final_positions_path":"/Users/kose/master/GPU-Accelerated-SGD-for-Stress-Minimization/experiment_results/v2/raw/v2-quality-timing/artifacts/v2-quality-timing-dwt_419-atomic_sparse_sgd-c0f68bf19192/attempt-1/atomic-sparse-sgd-dwt_419-v2-quality-timing-dwt_419-atomic_sparse_sgd-c0f68bf19192.final.txt","vertex_map_path":"/Users/kose/master/GPU-Accelerated-SGD-for-Stress-Minimization/experiment_results/v2/raw/v2-quality-timing/artifacts/v2-quality-timing-dwt_419-atomic_sparse_sgd-c0f68bf19192/attempt-1/atomic-sparse-sgd-dwt_419-v2-quality-timing-dwt_419-atomic_sparse_sgd-c0f68bf19192.vertex-map.txt","error_stage":null,"error_message":null,"exit_code":null,"stderr_log_path":null}
