{"schema_version":1,"run_id":"v2-quality-timing-1138_bus-atomic_sgd-6465016903a7","run_mode":"benchmark","method":"atomic_sgd","binary":"/Users/kose/master/GPU-Accelerated-SGD-for-Stress-Minimization/implementations/full/vram-lock-native/target/release/vram-lock-native","dataset":"1138_bus","input_path":"/Users/kose/master/GPU-Accelerated-SGD-for-Stress-Minimization/data/v1_lcc/1138_bus.mtx","input_sha256":"afcaf075fe4f259a66531455559b8056ee43a8aca039947a900d1b4e84c824eb","seed":24,"initial_positions_sha256":"854e4921efad977339be50d8a0d38c510cf21af2521beb9ec2c979deaa433c26","preprocess_sha256":null,"status":"success","family":"full","git_commit":"3593d62dec471a08e91dabe42a0c84f942418866","git_dirty":true,"nodes":1138,"edges":1458,"constraints":646953,"pivots":null,"iterations":15,"epsilon":0.1,"cpu_model":"Apple M4 Pro","gpu_name":"Apple M4 Pro","gpu_backend":"Metal","input_time_ms":0.109333,"common_preprocess_time_ms":14.722209,"method_setup_time_ms":3.0863750000000003,"runtime_init_time_ms":50.773792,"upload_time_ms":2.68625,"iteration_time_ms":775.377792,"gpu_device_time_ms":null,"readback_time_ms":0.003333,"postprocess_time_ms":0.001667,"algorithm_time_cold_ms":846.651418,"algorithm_time_warm_ms":795.8776260000001,"cli_total_time_cold_ms":846.760751,"stress_kind":"exact","stress_value":43013.503972546176,"stress_eval_time_ms":11.127417000000001,"stress_samples":null,"stress_seed":null,"attempted_updates":9704295,"completed_updates":9704295,"retry_failures":0,"rounds":null,"dispatches":15,"final_positions_path":"/Users/kose/master/GPU-Accelerated-SGD-for-Stress-Minimization/experiment_results/v2/raw/v2-quality-timing/artifacts/v2-quality-timing-1138_bus-atomic_sgd-6465016903a7/attempt-1/atomic-sgd-1138_bus-v2-quality-timing-1138_bus-atomic_sgd-6465016903a7.final.txt","vertex_map_path":null,"error_stage":null,"error_message":null,"exit_code":null,"stderr_log_path":null}
