{"algorithm_time_cold_ms":45.48675,"algorithm_time_warm_ms":32.871875,"attempted_updates":1313565,"binary":"/Users/kose/master/GPU-Accelerated-SGD-for-Stress-Minimization/implementations/full/rr_gpu/target/release/rr-gpu","cli_total_time_cold_ms":45.601625,"common_preprocess_time_ms":3.624083,"completed_updates":1313565,"constraints":87571,"cpu_model":"Apple M4 Pro","dataset":"dwt_419","dispatches":15,"edges":1572,"epsilon":0.1,"error_message":null,"error_stage":null,"exit_code":null,"family":"full","final_positions_path":"/Users/kose/master/GPU-Accelerated-SGD-for-Stress-Minimization/experiment_results/v2/raw/v2-quality-timing/artifacts/v2-quality-timing-dwt_419-rr_sgd-3e49a009da30/attempt-1/rr-sgd-dwt_419-v2-quality-timing-dwt_419-rr_sgd-3e49a009da30.final.txt","git_commit":"3593d62dec471a08e91dabe42a0c84f942418866","git_dirty":true,"gpu_backend":"Metal","gpu_device_time_ms":3.9904600000000006,"gpu_name":"Apple M4 Pro","initial_positions_sha256":"163a2d0513761577d4d5e7ba1198bdbd8df6193a92754f4a4f99fd5bd7118bd7","input_path":"/Users/kose/master/GPU-Accelerated-SGD-for-Stress-Minimization/data/v1_lcc/dwt_419.mtx","input_sha256":"12c72b640bc1947a3b6f35b995ab565f2eb7915e74837c981cf459bdf8daec1e","input_time_ms":0.114875,"iteration_time_ms":27.076042,"iterations":15,"method":"rr_sgd","method_setup_time_ms":0.000292,"nodes":419,"pivots":null,"postprocess_time_ms":0.0006670000000000001,"preprocess_sha256":null,"readback_time_ms":1.5430409999999999,"retry_failures":null,"rounds":1,"rr_inner_shuffle":true,"rr_memory_mode":"shared","rr_outer_shuffle":true,"rr_shared_bytes":16384,"rr_tile_size":1024,"rr_workgroup_size":256,"run_id":"v2-quality-timing-dwt_419-rr_sgd-3e49a009da30","run_mode":"benchmark","runtime_init_time_ms":12.614875,"schema_version":1,"seed":16,"status":"success","stderr_log_path":null,"stress_eval_time_ms":2.623459,"stress_kind":"exact","stress_samples":null,"stress_seed":null,"stress_value":1370.1455381385422,"upload_time_ms":0.62775,"vertex_map_path":null}
