{"schema_version":1,"run_id":"v4-basic-preferentialAttachment-atomic_sparse_sgd-s1-p200","run_mode":"benchmark","method":"atomic_sparse_sgd","binary":"/Users/kose/master/GPU-Accelerated-SGD-for-Stress-Minimization/implementations/sparse/vram-lock-sparse/target/release/vram-lock-sparse","dataset":"preferentialAttachment","input_path":"/Users/kose/master/GPU-Accelerated-SGD-for-Stress-Minimization/data/v4_lcc/preferentialAttachment.mtx","input_sha256":"fb8627ea2b2222ed5c71bd8150225ed8471efb9cc9f39f4bdadb760752bbb883","seed":1,"initial_positions_sha256":"bdd98baca5356063cca8803a52ed4d6154f65d56ebef2f8b53132c9b712971a7","preprocess_sha256":"d6038116022da35607bec3dd9a6532445afd0b67a553dfc7cf92774642f15c07","status":"success","family":"sparse","git_commit":"7dbf14a0cdb09acce1a73973c0b498922dbb20b6","git_dirty":true,"nodes":100000,"edges":499985,"constraints":20478011,"pivots":200,"iterations":15,"epsilon":0.1,"cpu_model":"Apple M4 Pro","gpu_name":"Apple M4 Pro","gpu_backend":"Metal","input_time_ms":136.508875,"common_preprocess_time_ms":3757.2520000000004,"method_setup_time_ms":109.784916,"runtime_init_time_ms":31.388958000000002,"upload_time_ms":160.08941700000003,"iteration_time_ms":2827.321541,"gpu_device_time_ms":null,"readback_time_ms":0.25670800000000005,"postprocess_time_ms":0.156542,"algorithm_time_cold_ms":6886.2500820000005,"algorithm_time_warm_ms":6854.861124000001,"cli_total_time_cold_ms":7022.758957,"stress_kind":"sampled","stress_value":992485673.6355641,"stress_eval_time_ms":984.132125,"stress_samples":256,"stress_seed":0,"attempted_updates":307170165,"completed_updates":307170165,"retry_failures":0,"rounds":null,"dispatches":260,"final_positions_path":"/Users/kose/master/GPU-Accelerated-SGD-for-Stress-Minimization/experiment_results/v4/raw/artifacts/v4-basic-preferentialAttachment-atomic_sparse_sgd-s1-p200/atomic-sparse-sgd-preferentialAttachment-v4-basic-preferentialAttachment-atomic_sparse_sgd-s1-p200.final.txt","vertex_map_path":"/Users/kose/master/GPU-Accelerated-SGD-for-Stress-Minimization/experiment_results/v4/raw/artifacts/v4-basic-preferentialAttachment-atomic_sparse_sgd-s1-p200/atomic-sparse-sgd-preferentialAttachment-v4-basic-preferentialAttachment-atomic_sparse_sgd-s1-p200.vertex-map.txt","error_stage":null,"error_message":null,"exit_code":null,"stderr_log_path":null}
