{"algorithm_time_cold_ms":4403.413666,"algorithm_time_warm_ms":4393.453916,"attempted_updates":167052600,"binary":"/Users/kose/master/GPU-Accelerated-SGD-for-Stress-Minimization/implementations/full/rr_gpu/target/release/rr-gpu","cli_total_time_cold_ms":4403.926874000001,"common_preprocess_time_ms":279.26295899999997,"completed_updates":167052600,"constraints":11136840,"cpu_model":"Apple M4 Pro","dataset":"3elt","dispatches":2235,"edges":13722,"epsilon":0.1,"error_message":null,"error_stage":null,"exit_code":null,"family":"full","final_positions_path":"/Users/kose/master/GPU-Accelerated-SGD-for-Stress-Minimization/experiment_results/v2/raw/v2-rr-memory-tiling/artifacts/v2-rr-memory-tiling-3elt-rr_sgd-2374d645c2f6/attempt-1/rr-sgd-3elt-v2-rr-memory-tiling-3elt-rr_sgd-2374d645c2f6.final.txt","git_commit":"3593d62dec471a08e91dabe42a0c84f942418866","git_dirty":true,"gpu_backend":"Metal","gpu_device_time_ms":4029.195917,"gpu_name":"Apple M4 Pro","initial_positions_sha256":"309371d0cf8967c5acd0abf26f7c05a0107f33c20b0dd556e3d3e2cd5d82f188","input_path":"/Users/kose/master/GPU-Accelerated-SGD-for-Stress-Minimization/data/v1_lcc/3elt.mtx","input_sha256":"757dec71920b6cbf505b628b2d74034cf416fa037e3a269e653e8a146ffc4614","input_time_ms":0.513208,"iteration_time_ms":4064.923792,"iterations":15,"method":"rr_sgd","method_setup_time_ms":0.04625,"nodes":4720,"pivots":null,"postprocess_time_ms":0.010832999999999999,"preprocess_sha256":null,"readback_time_ms":1.737291,"retry_failures":null,"rounds":149,"rr_inner_shuffle":true,"rr_memory_mode":"shared","rr_outer_shuffle":true,"rr_shared_bytes":512,"rr_tile_size":32,"rr_workgroup_size":256,"run_id":"v2-rr-memory-tiling-3elt-rr_sgd-2374d645c2f6","run_mode":"benchmark","runtime_init_time_ms":9.95975,"schema_version":1,"seed":1,"status":"success","stderr_log_path":null,"stress_eval_time_ms":195.978917,"stress_kind":"exact","stress_samples":null,"stress_seed":null,"stress_value":423352.0347581284,"upload_time_ms":47.472791,"vertex_map_path":null}
