{"schema_version":1,"run_id":"v2-large-sparse-luxembourg_osm-sparse_sgd-308ddc261f56","run_mode":"benchmark","method":"sparse_sgd","binary":"/Users/kose/master/GPU-Accelerated-SGD-for-Stress-Minimization/implementations/sparse/baseline-sparse-sgd-non-gpu/target/release/baseline-sparse-sgd-non-gpu","dataset":"luxembourg_osm","input_path":"/Users/kose/master/GPU-Accelerated-SGD-for-Stress-Minimization/data/v1_lcc/luxembourg_osm.mtx","input_sha256":"e4a84af2de64284a17e49907ef1b4c6aa20e749cab15b617cd2791b3f11ad526","seed":6,"initial_positions_sha256":"68a41eb326538361e50ce423c458fd5ef08a626615e8811aaf025203a9cf4f33","preprocess_sha256":"4c5bcac35de3d934396a9c2ef931e7d751f3b54020aaa84b9ef348e375153b6f","status":"success","family":"sparse","git_commit":"3593d62dec471a08e91dabe42a0c84f942418866","git_dirty":true,"nodes":114599,"edges":119666,"constraints":23018952,"pivots":200,"iterations":15,"epsilon":0.1,"cpu_model":"Apple M4 Pro","gpu_name":null,"gpu_backend":null,"input_time_ms":48.833292,"common_preprocess_time_ms":4473.178666,"method_setup_time_ms":null,"runtime_init_time_ms":null,"upload_time_ms":null,"iteration_time_ms":8977.064083,"gpu_device_time_ms":null,"readback_time_ms":null,"postprocess_time_ms":0.21470899999999998,"algorithm_time_cold_ms":13450.457457999999,"algorithm_time_warm_ms":13450.457457999999,"cli_total_time_cold_ms":13499.290749999998,"stress_kind":"sampled","stress_value":156280112.7785075,"stress_eval_time_ms":128.27575,"stress_samples":64,"stress_seed":0,"attempted_updates":null,"completed_updates":null,"retry_failures":null,"rounds":null,"dispatches":null,"final_positions_path":"/Users/kose/master/GPU-Accelerated-SGD-for-Stress-Minimization/experiment_results/v2/raw/v2-large-sparse/artifacts/v2-large-sparse-luxembourg_osm-sparse_sgd-308ddc261f56/attempt-1/sparse-sgd-luxembourg_osm-v2-large-sparse-luxembourg_osm-sparse_sgd-308ddc261f56.final.txt","vertex_map_path":"/Users/kose/master/GPU-Accelerated-SGD-for-Stress-Minimization/experiment_results/v2/raw/v2-large-sparse/artifacts/v2-large-sparse-luxembourg_osm-sparse_sgd-308ddc261f56/attempt-1/sparse-sgd-luxembourg_osm-v2-large-sparse-luxembourg_osm-sparse_sgd-308ddc261f56.vertex-map.txt","error_stage":null,"error_message":null,"exit_code":null,"stderr_log_path":null}
