{"schema_version":1,"run_id":"v2-quality-timing-3elt-atomic_sgd-b26cade07833","run_mode":"benchmark","method":"atomic_sgd","binary":"/Users/kose/master/GPU-Accelerated-SGD-for-Stress-Minimization/implementations/full/vram-lock-native/target/release/vram-lock-native","dataset":"3elt","input_path":"/Users/kose/master/GPU-Accelerated-SGD-for-Stress-Minimization/data/v1_lcc/3elt.mtx","input_sha256":"757dec71920b6cbf505b628b2d74034cf416fa037e3a269e653e8a146ffc4614","seed":20,"initial_positions_sha256":"3a51b9de62f329cee53370757c98153f731fd68efac25ea586f2fbe458ff7a51","preprocess_sha256":null,"status":"success","family":"full","git_commit":"3593d62dec471a08e91dabe42a0c84f942418866","git_dirty":true,"nodes":4720,"edges":13722,"constraints":11136840,"pivots":null,"iterations":15,"epsilon":0.1,"cpu_model":"Apple M4 Pro","gpu_name":"Apple M4 Pro","gpu_backend":"Metal","input_time_ms":0.781709,"common_preprocess_time_ms":337.560625,"method_setup_time_ms":48.644583999999995,"runtime_init_time_ms":65.191875,"upload_time_ms":50.843459,"iteration_time_ms":1481.796084,"gpu_device_time_ms":null,"readback_time_ms":0.019208,"postprocess_time_ms":0.007541,"algorithm_time_cold_ms":1984.0633759999998,"algorithm_time_warm_ms":1918.8715009999999,"cli_total_time_cold_ms":1984.845085,"stress_kind":"exact","stress_value":965167.1003911177,"stress_eval_time_ms":259.79445899999996,"stress_samples":null,"stress_seed":null,"attempted_updates":167052600,"completed_updates":167052600,"retry_failures":0,"rounds":null,"dispatches":15,"final_positions_path":"/Users/kose/master/GPU-Accelerated-SGD-for-Stress-Minimization/experiment_results/v2/raw/v2-quality-timing/artifacts/v2-quality-timing-3elt-atomic_sgd-b26cade07833/attempt-1/atomic-sgd-3elt-v2-quality-timing-3elt-atomic_sgd-b26cade07833.final.txt","vertex_map_path":null,"error_stage":null,"error_message":null,"exit_code":null,"stderr_log_path":null}
