{"algorithm_time_cold_ms":302.739833,"algorithm_time_warm_ms":291.348167,"attempted_updates":53847900,"binary":"/Users/kose/master/GPU-Accelerated-SGD-for-Stress-Minimization/implementations/full/rr_gpu/target/release/rr-gpu","cli_total_time_cold_ms":303.177125,"common_preprocess_time_ms":92.774375,"completed_updates":53847900,"constraints":3589860,"cpu_model":"Apple M4 Pro","dataset":"dwt_2680","dispatches":90,"edges":11173,"epsilon":0.1,"error_message":null,"error_stage":null,"exit_code":null,"family":"full","final_positions_path":"/Users/kose/master/GPU-Accelerated-SGD-for-Stress-Minimization/experiment_results/v2/raw/v2-rr-workgroup/artifacts/v2-rr-workgroup-dwt_2680-rr_sgd-13601e49ed8a/attempt-1/rr-sgd-dwt_2680-v2-rr-workgroup-dwt_2680-rr_sgd-13601e49ed8a.final.txt","git_commit":"3593d62dec471a08e91dabe42a0c84f942418866","git_dirty":true,"gpu_backend":"Metal","gpu_device_time_ms":161.460294,"gpu_name":"Apple M4 Pro","initial_positions_sha256":"f3085dc3f582ec5eea2f5ad511abecd727a0f95819010a5f466d5bcd436f6b33","input_path":"/Users/kose/master/GPU-Accelerated-SGD-for-Stress-Minimization/data/v1_lcc/dwt_2680.mtx","input_sha256":"af33ffce433ad2462057f06c8de36a48cd0fd68819c938f0c2836334cb814fda","input_time_ms":0.437292,"iteration_time_ms":179.985834,"iterations":15,"method":"rr_sgd","method_setup_time_ms":0.007042,"nodes":2680,"pivots":null,"postprocess_time_ms":0.003875,"preprocess_sha256":null,"readback_time_ms":1.562916,"retry_failures":null,"rounds":6,"rr_inner_shuffle":true,"rr_memory_mode":"shared","rr_outer_shuffle":true,"rr_shared_bytes":16384,"rr_tile_size":1024,"rr_workgroup_size":1024,"run_id":"v2-rr-workgroup-dwt_2680-rr_sgd-13601e49ed8a","run_mode":"benchmark","runtime_init_time_ms":11.391666,"schema_version":1,"seed":4,"status":"success","stderr_log_path":null,"stress_eval_time_ms":61.378707999999996,"stress_kind":"exact","stress_samples":null,"stress_seed":null,"stress_value":45611.07564571223,"upload_time_ms":17.014125,"vertex_map_path":null}
