{"schema_version":1,"run_id":"v2-quality-timing-dwt_1005-atomic_sgd-daa8d6b09830","run_mode":"benchmark","method":"atomic_sgd","binary":"/Users/kose/master/GPU-Accelerated-SGD-for-Stress-Minimization/implementations/full/vram-lock-native/target/release/vram-lock-native","dataset":"dwt_1005","input_path":"/Users/kose/master/GPU-Accelerated-SGD-for-Stress-Minimization/data/v1_lcc/dwt_1005.mtx","input_sha256":"47fe4b089487e6db7c6aafca32d6c9a6dda0f2f74749b1e6eb3a84cb013ecdbc","seed":4,"initial_positions_sha256":"84aa0e98574ade4fb71ccc9946feb04ab47011f268b8b16bf8a804893404d296","preprocess_sha256":null,"status":"success","family":"full","git_commit":"3593d62dec471a08e91dabe42a0c84f942418866","git_dirty":true,"nodes":1005,"edges":3808,"constraints":504510,"pivots":null,"iterations":15,"epsilon":0.1,"cpu_model":"Apple M4 Pro","gpu_name":"Apple M4 Pro","gpu_backend":"Metal","input_time_ms":0.242542,"common_preprocess_time_ms":15.701417,"method_setup_time_ms":1.9348340000000002,"runtime_init_time_ms":69.663459,"upload_time_ms":1.850875,"iteration_time_ms":719.497292,"gpu_device_time_ms":null,"readback_time_ms":0.0041659999999999996,"postprocess_time_ms":0.00175,"algorithm_time_cold_ms":808.6537930000001,"algorithm_time_warm_ms":738.9903340000001,"cli_total_time_cold_ms":808.896335,"stress_kind":"exact","stress_value":10877.526552018167,"stress_eval_time_ms":11.074083,"stress_samples":null,"stress_seed":null,"attempted_updates":7567650,"completed_updates":7567650,"retry_failures":0,"rounds":null,"dispatches":15,"final_positions_path":"/Users/kose/master/GPU-Accelerated-SGD-for-Stress-Minimization/experiment_results/v2/raw/v2-quality-timing/artifacts/v2-quality-timing-dwt_1005-atomic_sgd-daa8d6b09830/attempt-1/atomic-sgd-dwt_1005-v2-quality-timing-dwt_1005-atomic_sgd-daa8d6b09830.final.txt","vertex_map_path":null,"error_stage":null,"error_message":null,"exit_code":null,"stderr_log_path":null}
