{"schema_version":1,"run_id":"v2-quality-timing-dwt_2680-sgd-fd8b8946a333","run_mode":"benchmark","method":"sgd","binary":"/Users/kose/master/GPU-Accelerated-SGD-for-Stress-Minimization/implementations/full/baseline-sgd-non-gpu/target/release/baseline-sgd-non-gpu","dataset":"dwt_2680","input_path":"/Users/kose/master/GPU-Accelerated-SGD-for-Stress-Minimization/data/v1_lcc/dwt_2680.mtx","input_sha256":"af33ffce433ad2462057f06c8de36a48cd0fd68819c938f0c2836334cb814fda","seed":5,"initial_positions_sha256":"85fdaee76df5a57d59645896626acb68e13b0eab1edbc5ca33b099f941612fa5","preprocess_sha256":null,"status":"success","family":"full","git_commit":"3593d62dec471a08e91dabe42a0c84f942418866","git_dirty":true,"nodes":2680,"edges":11173,"constraints":3589860,"pivots":null,"iterations":15,"epsilon":0.1,"cpu_model":"Apple M4 Pro","gpu_name":null,"gpu_backend":null,"input_time_ms":0.617209,"common_preprocess_time_ms":110.471583,"method_setup_time_ms":null,"runtime_init_time_ms":null,"upload_time_ms":null,"iteration_time_ms":949.351042,"gpu_device_time_ms":null,"readback_time_ms":null,"postprocess_time_ms":0.0045000000000000005,"algorithm_time_cold_ms":1059.827125,"algorithm_time_warm_ms":1059.827125,"cli_total_time_cold_ms":1060.444334,"stress_kind":"exact","stress_value":45395.826015545485,"stress_eval_time_ms":86.780125,"stress_samples":null,"stress_seed":null,"attempted_updates":null,"completed_updates":null,"retry_failures":null,"rounds":null,"dispatches":null,"final_positions_path":"/Users/kose/master/GPU-Accelerated-SGD-for-Stress-Minimization/experiment_results/v2/raw/v2-quality-timing/artifacts/v2-quality-timing-dwt_2680-sgd-fd8b8946a333/attempt-1/sgd-dwt_2680-v2-quality-timing-dwt_2680-sgd-fd8b8946a333.final.txt","vertex_map_path":null,"error_stage":null,"error_message":null,"exit_code":null,"stderr_log_path":null}
