{"schema_version":1,"run_id":"v2-quality-timing-USpowerGrid-atomic_sgd-cafc875be96a","run_mode":"benchmark","method":"atomic_sgd","binary":"/Users/kose/master/GPU-Accelerated-SGD-for-Stress-Minimization/implementations/full/vram-lock-native/target/release/vram-lock-native","dataset":"USpowerGrid","input_path":"/Users/kose/master/GPU-Accelerated-SGD-for-Stress-Minimization/data/v1_lcc/USpowerGrid.mtx","input_sha256":"aac4faffbc2edd14ed031aeea76d64946d846e6b16d61d94e5d5d6a0a7aea9c0","seed":13,"initial_positions_sha256":"d3514c4d98a60beaacd320586bb24da66f0140400d59d258e653f70ba8c7c942","preprocess_sha256":null,"status":"success","family":"full","git_commit":"3593d62dec471a08e91dabe42a0c84f942418866","git_dirty":true,"nodes":4941,"edges":6594,"constraints":12204270,"pivots":null,"iterations":15,"epsilon":0.1,"cpu_model":"Apple M4 Pro","gpu_name":"Apple M4 Pro","gpu_backend":"Metal","input_time_ms":0.394709,"common_preprocess_time_ms":287.353458,"method_setup_time_ms":43.573792,"runtime_init_time_ms":59.1835,"upload_time_ms":55.336333,"iteration_time_ms":1400.910375,"gpu_device_time_ms":null,"readback_time_ms":0.020166999999999997,"postprocess_time_ms":0.008042,"algorithm_time_cold_ms":1846.3856669999998,"algorithm_time_warm_ms":1787.2021669999997,"cli_total_time_cold_ms":1846.7803759999997,"stress_kind":"exact","stress_value":727536.7021810657,"stress_eval_time_ms":217.60850000000002,"stress_samples":null,"stress_seed":null,"attempted_updates":183064050,"completed_updates":183064050,"retry_failures":0,"rounds":null,"dispatches":15,"final_positions_path":"/Users/kose/master/GPU-Accelerated-SGD-for-Stress-Minimization/experiment_results/v2/raw/v2-quality-timing/artifacts/v2-quality-timing-USpowerGrid-atomic_sgd-cafc875be96a/attempt-1/atomic-sgd-USpowerGrid-v2-quality-timing-USpowerGrid-atomic_sgd-cafc875be96a.final.txt","vertex_map_path":null,"error_stage":null,"error_message":null,"exit_code":null,"stderr_log_path":null}
