{"schema_version":1,"run_id":"v2-large-sparse-fe_4elt2-sparse_sgd-77a1283f3e94","run_mode":"benchmark","method":"sparse_sgd","binary":"/Users/kose/master/GPU-Accelerated-SGD-for-Stress-Minimization/implementations/sparse/baseline-sparse-sgd-non-gpu/target/release/baseline-sparse-sgd-non-gpu","dataset":"fe_4elt2","input_path":"/Users/kose/master/GPU-Accelerated-SGD-for-Stress-Minimization/data/v1_lcc/fe_4elt2.mtx","input_sha256":"e709478c366be98ce83aa46a5049e354dc6624c16a4076f53addc06cea41b189","seed":1,"initial_positions_sha256":"7e9660024934ed238d59d60fec22a85978a9a79a6293e22d57467a371a259653","preprocess_sha256":"f3b91c7a1781551086dff7db6501dff3d4e73a0b167d3c9d756c6bc1a6528bd9","status":"success","family":"sparse","git_commit":"3593d62dec471a08e91dabe42a0c84f942418866","git_dirty":true,"nodes":11143,"edges":32818,"constraints":2240162,"pivots":200,"iterations":15,"epsilon":0.1,"cpu_model":"Apple M4 Pro","gpu_name":null,"gpu_backend":null,"input_time_ms":10.401499999999999,"common_preprocess_time_ms":380.874917,"method_setup_time_ms":null,"runtime_init_time_ms":null,"upload_time_ms":null,"iteration_time_ms":633.999125,"gpu_device_time_ms":null,"readback_time_ms":null,"postprocess_time_ms":0.020417,"algorithm_time_cold_ms":1014.894459,"algorithm_time_warm_ms":1014.894459,"cli_total_time_cold_ms":1025.295959,"stress_kind":"sampled","stress_value":2815175.8673706795,"stress_eval_time_ms":14.764,"stress_samples":64,"stress_seed":0,"attempted_updates":null,"completed_updates":null,"retry_failures":null,"rounds":null,"dispatches":null,"final_positions_path":"/Users/kose/master/GPU-Accelerated-SGD-for-Stress-Minimization/experiment_results/v2/raw/v2-large-sparse/artifacts/v2-large-sparse-fe_4elt2-sparse_sgd-77a1283f3e94/attempt-1/sparse-sgd-fe_4elt2-v2-large-sparse-fe_4elt2-sparse_sgd-77a1283f3e94.final.txt","vertex_map_path":"/Users/kose/master/GPU-Accelerated-SGD-for-Stress-Minimization/experiment_results/v2/raw/v2-large-sparse/artifacts/v2-large-sparse-fe_4elt2-sparse_sgd-77a1283f3e94/attempt-1/sparse-sgd-fe_4elt2-v2-large-sparse-fe_4elt2-sparse_sgd-77a1283f3e94.vertex-map.txt","error_stage":null,"error_message":null,"exit_code":null,"stderr_log_path":null}
