{"algorithm_time_cold_ms":624.454166,"algorithm_time_warm_ms":614.72075,"attempted_updates":150158625,"binary":"/Users/kose/master/GPU-Accelerated-SGD-for-Stress-Minimization/implementations/full/rr_gpu/target/release/rr-gpu","cli_total_time_cold_ms":624.6704159999999,"common_preprocess_time_ms":174.47475,"completed_updates":150158625,"constraints":10010575,"cpu_model":"Apple M4 Pro","dataset":"EVA","dispatches":120,"edges":4652,"epsilon":0.1,"error_message":null,"error_stage":null,"exit_code":null,"family":"full","final_positions_path":"/Users/kose/master/GPU-Accelerated-SGD-for-Stress-Minimization/experiment_results/v2/raw/v2-rr-memory-tiling/artifacts/v2-rr-memory-tiling-EVA-rr_sgd-30dfef8fc788/attempt-1/rr-sgd-EVA-v2-rr-memory-tiling-EVA-rr_sgd-30dfef8fc788.final.txt","git_commit":"3593d62dec471a08e91dabe42a0c84f942418866","git_dirty":true,"gpu_backend":"Metal","gpu_device_time_ms":369.617456,"gpu_name":"Apple M4 Pro","initial_positions_sha256":"649a962d7a665e05e9057830e0a9844940356f0fd894bdf714e27edffd40a4f8","input_path":"/Users/kose/master/GPU-Accelerated-SGD-for-Stress-Minimization/data/v1_lcc/EVA.mtx","input_sha256":"c4d41f5347c24784d86bcea30f16dcc035f79120a95d37a2476a55686cb3ddde","input_time_ms":0.21625,"iteration_time_ms":390.604,"iterations":15,"method":"rr_sgd","method_setup_time_ms":0.006667,"nodes":4475,"pivots":null,"postprocess_time_ms":0.0053750000000000004,"preprocess_sha256":null,"readback_time_ms":1.718875,"retry_failures":null,"rounds":8,"rr_inner_shuffle":true,"rr_memory_mode":"global","rr_outer_shuffle":true,"rr_shared_bytes":0,"rr_tile_size":1024,"rr_workgroup_size":256,"run_id":"v2-rr-memory-tiling-EVA-rr_sgd-30dfef8fc788","run_mode":"benchmark","runtime_init_time_ms":9.733416,"schema_version":1,"seed":5,"status":"success","stderr_log_path":null,"stress_eval_time_ms":102.50125,"stress_kind":"exact","stress_samples":null,"stress_seed":null,"stress_value":1082238.1713284112,"upload_time_ms":47.911083,"vertex_map_path":null}
