{"algorithm_time_cold_ms":1193.1010410000001,"algorithm_time_warm_ms":1183.066583,"attempted_updates":53847900,"binary":"/Users/kose/master/GPU-Accelerated-SGD-for-Stress-Minimization/implementations/full/rr_gpu/target/release/rr-gpu","cli_total_time_cold_ms":1193.516832,"common_preprocess_time_ms":93.714417,"completed_updates":53847900,"constraints":3589860,"cpu_model":"Apple M4 Pro","dataset":"dwt_2680","dispatches":645,"edges":11173,"epsilon":0.1,"error_message":null,"error_stage":null,"exit_code":null,"family":"full","final_positions_path":"/Users/kose/master/GPU-Accelerated-SGD-for-Stress-Minimization/experiment_results/v2/raw/v2-rr-memory-tiling/artifacts/v2-rr-memory-tiling-dwt_2680-rr_sgd-db2d75a1ec11/attempt-1/rr-sgd-dwt_2680-v2-rr-memory-tiling-dwt_2680-rr_sgd-db2d75a1ec11.final.txt","git_commit":"3593d62dec471a08e91dabe42a0c84f942418866","git_dirty":true,"gpu_backend":"Metal","gpu_device_time_ms":1045.07479,"gpu_name":"Apple M4 Pro","initial_positions_sha256":"6fab0daa0bc457180a3b9a1357b30e22d98a74ef91fe65f1ae2f489dbef4551e","input_path":"/Users/kose/master/GPU-Accelerated-SGD-for-Stress-Minimization/data/v1_lcc/dwt_2680.mtx","input_sha256":"af33ffce433ad2462057f06c8de36a48cd0fd68819c938f0c2836334cb814fda","input_time_ms":0.41579099999999997,"iteration_time_ms":1072.44325,"iterations":15,"method":"rr_sgd","method_setup_time_ms":0.013040999999999999,"nodes":2680,"pivots":null,"postprocess_time_ms":0.004333,"preprocess_sha256":null,"readback_time_ms":1.552459,"retry_failures":null,"rounds":43,"rr_inner_shuffle":true,"rr_memory_mode":"global","rr_outer_shuffle":true,"rr_shared_bytes":0,"rr_tile_size":64,"rr_workgroup_size":256,"run_id":"v2-rr-memory-tiling-dwt_2680-rr_sgd-db2d75a1ec11","run_mode":"benchmark","runtime_init_time_ms":10.034457999999999,"schema_version":1,"seed":2,"status":"success","stderr_log_path":null,"stress_eval_time_ms":66.427,"stress_kind":"exact","stress_samples":null,"stress_seed":null,"stress_value":45548.263476834494,"upload_time_ms":15.339083,"vertex_map_path":null}
