{"schema_version":1,"run_id":"v4-basic-cage12-atomic_sparse_sgd-s0-p200","run_mode":"benchmark","method":"atomic_sparse_sgd","binary":"/Users/kose/master/GPU-Accelerated-SGD-for-Stress-Minimization/implementations/sparse/vram-lock-sparse/target/release/vram-lock-sparse","dataset":"cage12","input_path":"/Users/kose/master/GPU-Accelerated-SGD-for-Stress-Minimization/data/v4_lcc/cage12.mtx","input_sha256":"6d7f8fdca457904c662294b948f9f39a75f1e29985d0eb503bcba76b2a8e8630","seed":0,"initial_positions_sha256":"cbfd8b42b303b12a81048ded4a7e4c230d1849d090a8e7a5dc2e3a88e9185886","preprocess_sha256":"70248ec4adc1e3f5da1f96802eed483000025bd126615789b9644c918c337f9f","status":"success","family":"sparse","git_commit":"3eb792c1e38b9c7b15a8e579f93440f436bab751","git_dirty":true,"nodes":130228,"edges":951154,"constraints":26973909,"pivots":200,"iterations":15,"epsilon":0.1,"cpu_model":"Apple M4 Pro","gpu_name":"Apple M4 Pro","gpu_backend":"Metal","input_time_ms":246.669375,"common_preprocess_time_ms":4730.775833,"method_setup_time_ms":124.035583,"runtime_init_time_ms":34.261333,"upload_time_ms":114.494875,"iteration_time_ms":3233.9100420000004,"gpu_device_time_ms":null,"readback_time_ms":0.257292,"postprocess_time_ms":0.179958,"algorithm_time_cold_ms":8237.914916000002,"algorithm_time_warm_ms":8203.653583000001,"cli_total_time_cold_ms":8484.584291000001,"stress_kind":"sampled","stress_value":1348118159.3282669,"stress_eval_time_ms":1166.974375,"stress_samples":256,"stress_seed":0,"attempted_updates":404608635,"completed_updates":404608635,"retry_failures":0,"rounds":null,"dispatches":117,"final_positions_path":"/Users/kose/master/GPU-Accelerated-SGD-for-Stress-Minimization/experiment_results/v4/raw/artifacts/v4-basic-cage12-atomic_sparse_sgd-s0-p200/atomic-sparse-sgd-cage12-v4-basic-cage12-atomic_sparse_sgd-s0-p200.final.txt","vertex_map_path":"/Users/kose/master/GPU-Accelerated-SGD-for-Stress-Minimization/experiment_results/v4/raw/artifacts/v4-basic-cage12-atomic_sparse_sgd-s0-p200/atomic-sparse-sgd-cage12-v4-basic-cage12-atomic_sparse_sgd-s0-p200.vertex-map.txt","error_stage":null,"error_message":null,"exit_code":null,"stderr_log_path":null}
