{"schema_version":1,"run_id":"v2-quality-timing-poli-atomic_sgd-4b9b60d2484d","run_mode":"benchmark","method":"atomic_sgd","binary":"/Users/kose/master/GPU-Accelerated-SGD-for-Stress-Minimization/implementations/full/vram-lock-native/target/release/vram-lock-native","dataset":"poli","input_path":"/Users/kose/master/GPU-Accelerated-SGD-for-Stress-Minimization/data/v1_lcc/poli.mtx","input_sha256":"39aa40d05440a89f3c6489619e849353c363572b0a6dcd9a044035a6b880b1aa","seed":5,"initial_positions_sha256":"a03cfbd95f92a09c6ffe15c2e72f5df4f396b13cfd8bb8e100940827f72a8f77","preprocess_sha256":null,"status":"success","family":"full","git_commit":"3593d62dec471a08e91dabe42a0c84f942418866","git_dirty":true,"nodes":2343,"edges":2667,"constraints":2743653,"pivots":null,"iterations":15,"epsilon":0.1,"cpu_model":"Apple M4 Pro","gpu_name":"Apple M4 Pro","gpu_backend":"Metal","input_time_ms":0.17333400000000002,"common_preprocess_time_ms":55.84575,"method_setup_time_ms":11.123583,"runtime_init_time_ms":57.24175,"upload_time_ms":12.011707999999999,"iteration_time_ms":1017.7843330000001,"gpu_device_time_ms":null,"readback_time_ms":0.013791999999999999,"postprocess_time_ms":0.003834,"algorithm_time_cold_ms":1154.02475,"algorithm_time_warm_ms":1096.7830000000001,"cli_total_time_cold_ms":1154.198084,"stress_kind":"exact","stress_value":251340.2370273017,"stress_eval_time_ms":37.348166,"stress_samples":null,"stress_seed":null,"attempted_updates":41154795,"completed_updates":41154795,"retry_failures":0,"rounds":null,"dispatches":15,"final_positions_path":"/Users/kose/master/GPU-Accelerated-SGD-for-Stress-Minimization/experiment_results/v2/raw/v2-quality-timing/artifacts/v2-quality-timing-poli-atomic_sgd-4b9b60d2484d/attempt-1/atomic-sgd-poli-v2-quality-timing-poli-atomic_sgd-4b9b60d2484d.final.txt","vertex_map_path":null,"error_stage":null,"error_message":null,"exit_code":null,"stderr_log_path":null}
