{"algorithm_time_cold_ms":856.5035420000002,"algorithm_time_warm_ms":843.6477500000002,"attempted_updates":183064050,"binary":"/Users/kose/master/GPU-Accelerated-SGD-for-Stress-Minimization/implementations/full/rr_gpu/target/release/rr-gpu","cli_total_time_cold_ms":856.9024170000001,"common_preprocess_time_ms":355.309208,"completed_updates":183064050,"constraints":12204270,"cpu_model":"Apple M4 Pro","dataset":"USpowerGrid","dispatches":120,"edges":6594,"epsilon":0.1,"error_message":null,"error_stage":null,"exit_code":null,"family":"full","final_positions_path":"/Users/kose/master/GPU-Accelerated-SGD-for-Stress-Minimization/experiment_results/v2/raw/v2-quality-timing/artifacts/v2-quality-timing-USpowerGrid-rr_sgd-fb0fb030bf31/attempt-1/rr-sgd-USpowerGrid-v2-quality-timing-USpowerGrid-rr_sgd-fb0fb030bf31.final.txt","git_commit":"3593d62dec471a08e91dabe42a0c84f942418866","git_dirty":true,"gpu_backend":"Metal","gpu_device_time_ms":343.862,"gpu_name":"Apple M4 Pro","initial_positions_sha256":"e112f15ee112e6bcafc9875b1561472bb35f4439a178928f6d1214e59684cb6f","input_path":"/Users/kose/master/GPU-Accelerated-SGD-for-Stress-Minimization/data/v1_lcc/USpowerGrid.mtx","input_sha256":"aac4faffbc2edd14ed031aeea76d64946d846e6b16d61d94e5d5d6a0a7aea9c0","input_time_ms":0.398875,"iteration_time_ms":397.556875,"iterations":15,"method":"rr_sgd","method_setup_time_ms":0.011542,"nodes":4941,"pivots":null,"postprocess_time_ms":0.008042,"preprocess_sha256":null,"readback_time_ms":1.565,"retry_failures":null,"rounds":8,"rr_inner_shuffle":true,"rr_memory_mode":"shared","rr_outer_shuffle":true,"rr_shared_bytes":16384,"rr_tile_size":1024,"rr_workgroup_size":256,"run_id":"v2-quality-timing-USpowerGrid-rr_sgd-fb0fb030bf31","run_mode":"benchmark","runtime_init_time_ms":12.855792,"schema_version":1,"seed":8,"status":"success","stderr_log_path":null,"stress_eval_time_ms":217.112125,"stress_kind":"exact","stress_samples":null,"stress_seed":null,"stress_value":716315.0021439205,"upload_time_ms":89.19708299999999,"vertex_map_path":null}
