{"schema_version":1,"run_id":"v2-quality-timing-dwt_419-rr_sparse_sgd-b103d674f612","run_mode":"benchmark","method":"rr_sparse_sgd","binary":"/Users/kose/master/GPU-Accelerated-SGD-for-Stress-Minimization/implementations/sparse/sparse-sgd-gpu/target/release/sparse-sgd-gpu","dataset":"dwt_419","input_path":"/Users/kose/master/GPU-Accelerated-SGD-for-Stress-Minimization/data/v1_lcc/dwt_419.mtx","input_sha256":"12c72b640bc1947a3b6f35b995ab565f2eb7915e74837c981cf459bdf8daec1e","seed":10,"initial_positions_sha256":"1ddf770dbc1b332b613b42087f5b55e38c9527e45b3fe4b09f36359018677ac9","preprocess_sha256":"5198e45e2e5ff784a3a25d7155f4fcfdbaafc5e4768d40300b43df54f36032c3","status":"success","family":"sparse","git_commit":"3593d62dec471a08e91dabe42a0c84f942418866","git_dirty":true,"nodes":419,"edges":1572,"constraints":64113,"pivots":200,"iterations":15,"epsilon":0.1,"cpu_model":"Apple M4 Pro","gpu_name":"Apple M4 Pro","gpu_backend":"Metal","input_time_ms":0.509459,"common_preprocess_time_ms":11.687084,"method_setup_time_ms":3.588583,"runtime_init_time_ms":12.372417,"upload_time_ms":1.039208,"iteration_time_ms":174.501041,"gpu_device_time_ms":null,"readback_time_ms":1.557458,"postprocess_time_ms":0.000625,"algorithm_time_cold_ms":204.746416,"algorithm_time_warm_ms":192.373999,"cli_total_time_cold_ms":205.255875,"stress_kind":"exact","stress_value":1412.7071563405714,"stress_eval_time_ms":2.624041,"stress_samples":null,"stress_seed":null,"attempted_updates":null,"completed_updates":null,"retry_failures":null,"rounds":209,"dispatches":3150,"final_positions_path":"/Users/kose/master/GPU-Accelerated-SGD-for-Stress-Minimization/experiment_results/v2/raw/v2-quality-timing/artifacts/v2-quality-timing-dwt_419-rr_sparse_sgd-b103d674f612/attempt-1/rr-sparse-sgd-dwt_419-v2-quality-timing-dwt_419-rr_sparse_sgd-b103d674f612.final.txt","vertex_map_path":"/Users/kose/master/GPU-Accelerated-SGD-for-Stress-Minimization/experiment_results/v2/raw/v2-quality-timing/artifacts/v2-quality-timing-dwt_419-rr_sparse_sgd-b103d674f612/attempt-1/rr-sparse-sgd-dwt_419-v2-quality-timing-dwt_419-rr_sparse_sgd-b103d674f612.vertex-map.txt","error_stage":null,"error_message":null,"exit_code":null,"stderr_log_path":null}
