{"schema_version":1,"run_id":"v2-quality-timing-USpowerGrid-rr_sparse_sgd-68e78da0d586","run_mode":"benchmark","method":"rr_sparse_sgd","binary":"/Users/kose/master/GPU-Accelerated-SGD-for-Stress-Minimization/implementations/sparse/sparse-sgd-gpu/target/release/sparse-sgd-gpu","dataset":"USpowerGrid","input_path":"/Users/kose/master/GPU-Accelerated-SGD-for-Stress-Minimization/data/v1_lcc/USpowerGrid.mtx","input_sha256":"aac4faffbc2edd14ed031aeea76d64946d846e6b16d61d94e5d5d6a0a7aea9c0","seed":10,"initial_positions_sha256":"afc06002734e1beb5aae7fe4aab2cb24eedda882c533346b8954f71988838c67","preprocess_sha256":"b37fdac16ec713446f4a7481b3ac0c4ced0134758aea5a219bba326ad3ec410c","status":"success","family":"sparse","git_commit":"3593d62dec471a08e91dabe42a0c84f942418866","git_dirty":true,"nodes":4941,"edges":6594,"constraints":974207,"pivots":200,"iterations":15,"epsilon":0.1,"cpu_model":"Apple M4 Pro","gpu_name":"Apple M4 Pro","gpu_backend":"Metal","input_time_ms":2.3427919999999998,"common_preprocess_time_ms":168.772583,"method_setup_time_ms":27.523333,"runtime_init_time_ms":12.341375,"upload_time_ms":2.6550409999999998,"iteration_time_ms":176.66279200000002,"gpu_device_time_ms":null,"readback_time_ms":1.564208,"postprocess_time_ms":0.008333,"algorithm_time_cold_ms":389.52766500000007,"algorithm_time_warm_ms":377.1862900000001,"cli_total_time_cold_ms":391.87045700000004,"stress_kind":"exact","stress_value":737863.5146957856,"stress_eval_time_ms":213.067666,"stress_samples":null,"stress_seed":null,"attempted_updates":null,"completed_updates":null,"retry_failures":null,"rounds":209,"dispatches":3150,"final_positions_path":"/Users/kose/master/GPU-Accelerated-SGD-for-Stress-Minimization/experiment_results/v2/raw/v2-quality-timing/artifacts/v2-quality-timing-USpowerGrid-rr_sparse_sgd-68e78da0d586/attempt-1/rr-sparse-sgd-USpowerGrid-v2-quality-timing-USpowerGrid-rr_sparse_sgd-68e78da0d586.final.txt","vertex_map_path":"/Users/kose/master/GPU-Accelerated-SGD-for-Stress-Minimization/experiment_results/v2/raw/v2-quality-timing/artifacts/v2-quality-timing-USpowerGrid-rr_sparse_sgd-68e78da0d586/attempt-1/rr-sparse-sgd-USpowerGrid-v2-quality-timing-USpowerGrid-rr_sparse_sgd-68e78da0d586.vertex-map.txt","error_stage":null,"error_message":null,"exit_code":null,"stderr_log_path":null}
