{"schema_version":1,"run_id":"v2-quality-timing-EVA-atomic_sgd-da1d47b0cd4a","run_mode":"benchmark","method":"atomic_sgd","binary":"/Users/kose/master/GPU-Accelerated-SGD-for-Stress-Minimization/implementations/full/vram-lock-native/target/release/vram-lock-native","dataset":"EVA","input_path":"/Users/kose/master/GPU-Accelerated-SGD-for-Stress-Minimization/data/v1_lcc/EVA.mtx","input_sha256":"c4d41f5347c24784d86bcea30f16dcc035f79120a95d37a2476a55686cb3ddde","seed":12,"initial_positions_sha256":"33d8858353a4476f4a58ed0165cac5092452e7766c3324bfd76598cc401137f6","preprocess_sha256":null,"status":"success","family":"full","git_commit":"3593d62dec471a08e91dabe42a0c84f942418866","git_dirty":true,"nodes":4475,"edges":4652,"constraints":10010575,"pivots":null,"iterations":15,"epsilon":0.1,"cpu_model":"Apple M4 Pro","gpu_name":"Apple M4 Pro","gpu_backend":"Metal","input_time_ms":0.279791,"common_preprocess_time_ms":227.185417,"method_setup_time_ms":36.898209,"runtime_init_time_ms":60.021209,"upload_time_ms":47.197167,"iteration_time_ms":1428.800375,"gpu_device_time_ms":null,"readback_time_ms":0.024166,"postprocess_time_ms":0.007375,"algorithm_time_cold_ms":1800.1339179999998,"algorithm_time_warm_ms":1740.1127089999998,"cli_total_time_cold_ms":1800.4137089999997,"stress_kind":"exact","stress_value":1154423.6572410988,"stress_eval_time_ms":132.95950000000002,"stress_samples":null,"stress_seed":null,"attempted_updates":150158625,"completed_updates":150158625,"retry_failures":0,"rounds":null,"dispatches":15,"final_positions_path":"/Users/kose/master/GPU-Accelerated-SGD-for-Stress-Minimization/experiment_results/v2/raw/v2-quality-timing/artifacts/v2-quality-timing-EVA-atomic_sgd-da1d47b0cd4a/attempt-1/atomic-sgd-EVA-v2-quality-timing-EVA-atomic_sgd-da1d47b0cd4a.final.txt","vertex_map_path":null,"error_stage":null,"error_message":null,"exit_code":null,"stderr_log_path":null}
