{"schema_version":1,"run_id":"v2-quality-timing-dwt_419-sparse_sgd-4891061e4781","run_mode":"benchmark","method":"sparse_sgd","binary":"/Users/kose/master/GPU-Accelerated-SGD-for-Stress-Minimization/implementations/sparse/baseline-sparse-sgd-non-gpu/target/release/baseline-sparse-sgd-non-gpu","dataset":"dwt_419","input_path":"/Users/kose/master/GPU-Accelerated-SGD-for-Stress-Minimization/data/v1_lcc/dwt_419.mtx","input_sha256":"12c72b640bc1947a3b6f35b995ab565f2eb7915e74837c981cf459bdf8daec1e","seed":14,"initial_positions_sha256":"d5077eed11528576c0da92c89655729528189a5ab2994f50dea0ba52ffc1698f","preprocess_sha256":"33f9c91288ec07df952140295d36b97936c9b86fa09c84c123ef084c95f119a0","status":"success","family":"sparse","git_commit":"3593d62dec471a08e91dabe42a0c84f942418866","git_dirty":true,"nodes":419,"edges":1572,"constraints":64115,"pivots":200,"iterations":15,"epsilon":0.1,"cpu_model":"Apple M4 Pro","gpu_name":null,"gpu_backend":null,"input_time_ms":0.52225,"common_preprocess_time_ms":11.752666999999999,"method_setup_time_ms":null,"runtime_init_time_ms":null,"upload_time_ms":null,"iteration_time_ms":9.572583000000002,"gpu_device_time_ms":null,"readback_time_ms":null,"postprocess_time_ms":0.000541,"algorithm_time_cold_ms":21.325791,"algorithm_time_warm_ms":21.325791,"cli_total_time_cold_ms":21.848041,"stress_kind":"exact","stress_value":1408.0293594736227,"stress_eval_time_ms":2.472166,"stress_samples":null,"stress_seed":null,"attempted_updates":null,"completed_updates":null,"retry_failures":null,"rounds":null,"dispatches":null,"final_positions_path":"/Users/kose/master/GPU-Accelerated-SGD-for-Stress-Minimization/experiment_results/v2/raw/v2-quality-timing/artifacts/v2-quality-timing-dwt_419-sparse_sgd-4891061e4781/attempt-1/sparse-sgd-dwt_419-v2-quality-timing-dwt_419-sparse_sgd-4891061e4781.final.txt","vertex_map_path":"/Users/kose/master/GPU-Accelerated-SGD-for-Stress-Minimization/experiment_results/v2/raw/v2-quality-timing/artifacts/v2-quality-timing-dwt_419-sparse_sgd-4891061e4781/attempt-1/sparse-sgd-dwt_419-v2-quality-timing-dwt_419-sparse_sgd-4891061e4781.vertex-map.txt","error_stage":null,"error_message":null,"exit_code":null,"stderr_log_path":null}
