{"algorithm_time_cold_ms":75.376832,"algorithm_time_warm_ms":63.14408199999999,"attempted_updates":7719075,"binary":"/Users/kose/master/GPU-Accelerated-SGD-for-Stress-Minimization/implementations/full/rr_gpu/target/release/rr-gpu","cli_total_time_cold_ms":75.671624,"common_preprocess_time_ms":25.405125,"completed_updates":7719075,"constraints":514605,"cpu_model":"Apple M4 Pro","dataset":"cage8","dispatches":15,"edges":4994,"epsilon":0.1,"error_message":null,"error_stage":null,"exit_code":null,"family":"full","final_positions_path":"/Users/kose/master/GPU-Accelerated-SGD-for-Stress-Minimization/experiment_results/v2/raw/v2-quality-timing/artifacts/v2-quality-timing-cage8-rr_sgd-4493bb98e2f6/attempt-1/rr-sgd-cage8-v2-quality-timing-cage8-rr_sgd-4493bb98e2f6.final.txt","git_commit":"3593d62dec471a08e91dabe42a0c84f942418866","git_dirty":true,"gpu_backend":"Metal","gpu_device_time_ms":17.798253,"gpu_name":"Apple M4 Pro","initial_positions_sha256":"d6df1f063dfc4061774459c0ee50f6540a0f51c36f17f0bdd35c82fdb329cacb","input_path":"/Users/kose/master/GPU-Accelerated-SGD-for-Stress-Minimization/data/v1_lcc/cage8.mtx","input_sha256":"6f476b079cc643acbe618f815cce6465bd16f88fd53a9f2825c3b19e52de7b36","input_time_ms":0.294792,"iteration_time_ms":33.569917,"iterations":15,"method":"rr_sgd","method_setup_time_ms":0.00029099999999999997,"nodes":1015,"pivots":null,"postprocess_time_ms":0.001708,"preprocess_sha256":null,"readback_time_ms":1.572583,"retry_failures":null,"rounds":1,"rr_inner_shuffle":true,"rr_memory_mode":"shared","rr_outer_shuffle":true,"rr_shared_bytes":16384,"rr_tile_size":1024,"rr_workgroup_size":256,"run_id":"v2-quality-timing-cage8-rr_sgd-4493bb98e2f6","run_mode":"benchmark","runtime_init_time_ms":12.232750000000001,"schema_version":1,"seed":3,"status":"success","stderr_log_path":null,"stress_eval_time_ms":19.224542,"stress_kind":"exact","stress_samples":null,"stress_seed":null,"stress_value":60552.701867217715,"upload_time_ms":2.594458,"vertex_map_path":null}
