{"schema_version":1,"run_id":"v2-quality-timing-3elt-sgd-7e55aa8db9f0","run_mode":"benchmark","method":"sgd","binary":"/Users/kose/master/GPU-Accelerated-SGD-for-Stress-Minimization/implementations/full/baseline-sgd-non-gpu/target/release/baseline-sgd-non-gpu","dataset":"3elt","input_path":"/Users/kose/master/GPU-Accelerated-SGD-for-Stress-Minimization/data/v1_lcc/3elt.mtx","input_sha256":"757dec71920b6cbf505b628b2d74034cf416fa037e3a269e653e8a146ffc4614","seed":24,"initial_positions_sha256":"bcf5b289e4900dbdd4da4b57d51a095ac8b9249e541f8c7d1f861fb2bb3e0029","preprocess_sha256":null,"status":"success","family":"full","git_commit":"3593d62dec471a08e91dabe42a0c84f942418866","git_dirty":true,"nodes":4720,"edges":13722,"constraints":11136840,"pivots":null,"iterations":15,"epsilon":0.1,"cpu_model":"Apple M4 Pro","gpu_name":null,"gpu_backend":null,"input_time_ms":0.782542,"common_preprocess_time_ms":333.41537500000004,"method_setup_time_ms":null,"runtime_init_time_ms":null,"upload_time_ms":null,"iteration_time_ms":3282.636333,"gpu_device_time_ms":null,"readback_time_ms":null,"postprocess_time_ms":0.008042,"algorithm_time_cold_ms":3616.05975,"algorithm_time_warm_ms":3616.05975,"cli_total_time_cold_ms":3616.842292,"stress_kind":"exact","stress_value":422896.2764792758,"stress_eval_time_ms":255.75154100000003,"stress_samples":null,"stress_seed":null,"attempted_updates":null,"completed_updates":null,"retry_failures":null,"rounds":null,"dispatches":null,"final_positions_path":"/Users/kose/master/GPU-Accelerated-SGD-for-Stress-Minimization/experiment_results/v2/raw/v2-quality-timing/artifacts/v2-quality-timing-3elt-sgd-7e55aa8db9f0/attempt-1/sgd-3elt-v2-quality-timing-3elt-sgd-7e55aa8db9f0.final.txt","vertex_map_path":null,"error_stage":null,"error_message":null,"exit_code":null,"stderr_log_path":null}
